{
	"lesson_id": "demo8",
	"title": "C 語言字串基礎",
	"slides": [
		{
			"id": "p1",
			"role": "hook",
			"note": "強調 C 沒有字串型態，等號指定與少留一格是兩大痛點。",
			"elements": [
				{
					"id": "p1_title",
					"type": "title",
					"text": "為什麼 name = \"Alice\" 會出事"
				},
				{
					"id": "p1_sub",
					"type": "subtitle",
					"text": "從 Python 轉過來最常踩的第一個坑"
				},
				{
					"id": "p1_a",
					"type": "bullet",
					"text": "C 沒有字串型態，等號指定的是位址"
				},
				{
					"id": "p1_b",
					"type": "bullet",
					"text": "char name[5] 存 Alice，結束字元沒地方放",
					"hidden": true
				},
				{
					"id": "p1_c",
					"type": "callout",
					"text": "陣列長度要留一格給結束字元",
					"hidden": true
				},
				{
					"id": "p1_fig",
					"type": "figure",
					"kind": "compare",
					"left": {
						"title": "Python 想法",
						"items": [
							"name = \"Alice\"",
							"直接換內容"
						]
					},
					"right": {
						"title": "C 的現實",
						"items": [
							"char 陣列起點",
							"等號給的是位址"
						]
					}
				}
			]
		},
		{
			"id": "p2",
			"role": "concept",
			"note": "核心是哨兵 \\0，並把容量與長度分開講。",
			"elements": [
				{
					"id": "p2_title",
					"type": "title",
					"text": "字串就是收尾的字元陣列"
				},
				{
					"id": "p2_sub",
					"type": "subtitle",
					"text": "結尾多放一個 \\0 當哨兵"
				},
				{
					"id": "p2_a",
					"type": "bullet",
					"text": "標準函式靠哨兵判斷字串在哪結束"
				},
				{
					"id": "p2_b",
					"type": "bullet",
					"text": "沒有哨兵就會一路讀到陣列外面",
					"hidden": true
				},
				{
					"id": "p2_c",
					"type": "callout",
					"text": "存 n 個字，陣列至少要 n 加一格",
					"hidden": true
				},
				{
					"id": "p2_fig",
					"type": "figure",
					"kind": "boxes",
					"items": [
						"A",
						"l",
						"i",
						"c",
						"\\0"
					],
					"left": {},
					"right": {}
				}
			]
		},
		{
			"id": "p3",
			"role": "concept",
			"note": "把容量與長度的差別獨立說清楚，為走讀第七行鋪路。",
			"elements": [
				{
					"id": "p3_title",
					"type": "title",
					"text": "容量不等於長度"
				},
				{
					"id": "p3_sub",
					"type": "subtitle",
					"text": "兩個常被混在一起的數字"
				},
				{
					"id": "p3_a",
					"type": "bullet",
					"text": "容量是你宣告的陣列格數"
				},
				{
					"id": "p3_b",
					"type": "callout",
					"text": "長度是哨兵前面有幾個字元",
					"hidden": true
				},
				{
					"id": "p3_fig",
					"type": "figure",
					"kind": "compare",
					"left": {
						"title": "容量",
						"items": [
							"char name[32]",
							"宣告時決定",
							"共 32 格"
						]
					},
					"right": {
						"title": "長度",
						"items": [
							"strlen 量出來",
							"哨兵前的字元數",
							"Alice 是 5"
						]
					}
				}
			]
		},
		{
			"id": "p4",
			"role": "walkthrough",
			"note": "四步走讀：宣告容量、複製內容、量長度、印出。特別點出第五行是垃圾值、第六行不能用等號、第七行是 5 不是 32。",
			"elements": [
				{
					"id": "p4_title",
					"type": "title",
					"text": "程式碼走讀"
				},
				{
					"id": "p4_sub",
					"type": "subtitle",
					"text": "宣告、複製、量長度、印出"
				},
				{
					"id": "p4_code",
					"type": "code",
					"lang": "c",
					"lines": [
						"#include <stdio.h>",
						"#include <string.h>",
						"",
						"int main() {",
						"    char name[32];",
						"    strcpy(name, \"Alice\");",
						"    printf(\"%s 共 %d 個字\\n\", name, (int)strlen(name));",
						"    return 0;",
						"}"
					]
				}
			]
		},
		{
			"id": "p5",
			"role": "pitfall",
			"note": "收束在兩個等號迷思：不能用等號指定、不能用等號比較。",
			"elements": [
				{
					"id": "p5_title",
					"type": "title",
					"text": "兩個等號的迷思"
				},
				{
					"id": "p5_sub",
					"type": "subtitle",
					"text": "指定要用複製，比較要用比較函式"
				},
				{
					"id": "p5_a",
					"type": "bullet",
					"text": "等號比較比到的是兩塊記憶體位址"
				},
				{
					"id": "p5_b",
					"type": "bullet",
					"text": "位址永遠不相等，要用字串比較函式",
					"hidden": true
				},
				{
					"id": "p5_c",
					"type": "callout",
					"text": "字串內容只能一個字元一個字元搬",
					"hidden": true
				},
				{
					"id": "p5_fig",
					"type": "figure",
					"kind": "steps",
					"items": [
						"宣告容量",
						"複製內容",
						"量出長度",
						"印出結果"
					]
				}
			]
		}
	],
	"voice": {
		"model": "wang_teacher_v3",
		"speed_factor": 0.95,
		"text_lang": "zh",
		"text_split_method": "cut5"
	}
}