{
	"lesson_id": "demo8b",
	"title": "C 語言字串基礎",
	"slides": [
		{
			"id": "p1",
			"role": "hook",
			"note": "強調 C 沒有字串型態，等號指定與陣列少留一格是兩個最常見的痛點。",
			"elements": [
				{
					"id": "p1_title",
					"type": "title",
					"text": "為什麼 name = \"Alice\" 會出事"
				},
				{
					"id": "p1_sub",
					"type": "subtitle",
					"text": "從 Python 轉過來最常踩的兩個坑"
				},
				{
					"id": "p1_a",
					"type": "bullet",
					"text": "C 沒有字串型態，name 只是字元陣列的起點"
				},
				{
					"id": "p1_b",
					"type": "bullet",
					"text": "等號指定到的是位址，不是內容",
					"hidden": true
				},
				{
					"id": "p1_c",
					"type": "callout",
					"text": "char name[5] 存 Alice，結束字元沒地方放，印出亂碼",
					"hidden": true
				},
				{
					"id": "p1_fig",
					"type": "figure",
					"kind": "compare",
					"left": {
						"title": "Python 寫法",
						"items": [
							"name = \"Alice\"",
							"有字串型態",
							"長度自動處理"
						]
					},
					"right": {
						"title": "C 的現實",
						"items": [
							"char 陣列",
							"等號給的是位址",
							"要自己留結束字元"
						]
					}
				}
			]
		},
		{
			"id": "p2",
			"role": "concept",
			"note": "核心是哨兵 '\\0'，並把容量與長度分清楚。",
			"elements": [
				{
					"id": "p2_title",
					"type": "title",
					"text": "字串就是收尾的字元陣列"
				},
				{
					"id": "p2_sub",
					"type": "subtitle",
					"text": "哨兵 '\\0' 決定字串在哪裡結束"
				},
				{
					"id": "p2_a",
					"type": "bullet",
					"text": "字串是 char 陣列，結尾多放一個 '\\0'"
				},
				{
					"id": "p2_b",
					"type": "bullet",
					"text": "標準函式全靠哨兵判斷結束，沒有它會讀到陣列外",
					"hidden": true
				},
				{
					"id": "p2_c",
					"type": "callout",
					"text": "容量是宣告格數，長度是哨兵前的字元數",
					"hidden": true
				},
				{
					"id": "p2_fig",
					"type": "figure",
					"kind": "boxes",
					"items": [
						"A",
						"l",
						"i",
						"c",
						"\\0"
					],
					"right": {}
				}
			]
		},
		{
			"id": "p3",
			"role": "walkthrough",
			"note": "分四步走讀：宣告容量、複製內容、量長度、印出。特別點出第五行是容量、第六行不能用等號、第七行量到五。",
			"elements": [
				{
					"id": "p3_title",
					"type": "title",
					"text": "程式碼走讀"
				},
				{
					"id": "p3_sub",
					"type": "subtitle",
					"text": "宣告、複製、量長度、印出"
				},
				{
					"id": "p3_code",
					"type": "code",
					"lang": "c",
					"lines": [
						"#include <stdio.h>",
						"#include <string.h>",
						"",
						"int main() {",
						"    char name[32];",
						"    strcpy(name, \"Alice\");",
						"    printf(\"%s 共 %d 個字\\n\", name, (int)strlen(name));",
						"    return 0;",
						"}"
					]
				}
			]
		},
		{
			"id": "p4",
			"role": "pitfall",
			"note": "收在三個迷思：等號指定、少留一格、等號比較。",
			"elements": [
				{
					"id": "p4_title",
					"type": "title",
					"text": "三個一定要避開的寫法"
				},
				{
					"id": "p4_sub",
					"type": "subtitle",
					"text": "複製要用函式，比較也要用函式"
				},
				{
					"id": "p4_a",
					"type": "bullet",
					"text": "內容不能用等號指定，要用字串複製函式"
				},
				{
					"id": "p4_b",
					"type": "bullet",
					"text": "存 n 個字，陣列至少要 n 加一格",
					"hidden": true
				},
				{
					"id": "p4_c",
					"type": "callout",
					"text": "用等號比較字串比到的是位址，永遠不相等",
					"hidden": true
				},
				{
					"id": "p4_fig",
					"type": "figure",
					"kind": "steps",
					"items": [
						"宣告容量",
						"複製內容",
						"量出長度",
						"印出結果"
					]
				}
			]
		}
	],
	"voice": {
		"model": "wang_teacher_v3",
		"speed_factor": 0.95,
		"text_lang": "zh",
		"text_split_method": "cut5"
	}
}